### ISSUE TITLE
incorrect TCP session handling with TLS

### ISSUE THREAD

**Issue by ksyblast** [radcli/radcli#89]
Please have a look at the TCP session (1.1.1.1 is OCS and 2.2.2.2 is a RADIUS server). Session is established and everything looks good:
```
15:13:40.038672 IP (tos 0x0, ttl 64, id 39093, offset 0, flags [DF], proto TCP (6), length 60)
    1.1.1.1.35466 > 2.2.2.2.2083: Flags [S], cksum 0x1a47 (incorrect -> 0xd909), seq 3892725565, win 29200, options [mss 1200,sackOK,TS val 1277744567 ecr 0,nop,wscale 7], length 0
15:13:40.038881 IP (tos 0x0, ttl 64, id 0, offset 0, flags [DF], proto TCP (6), length 60)
    2.2.2.2.2083 > 1.1.1.1.35466: Flags [S.], cksum 0x2309 (correct), seq 380892667, ack 3892725566, win 28960, options [mss 1460,sackOK,TS val 4160336178 ecr 1277744567,nop,wscale 7], length 0
15:13:40.038903 IP (tos 0x0, ttl 64, id 39094, offset 0, flags [DF], proto TCP (6), length 52)
    1.1.1.1.35466 > 2.2.2.2.2083: Flags [.], cksum 0x1a3f (incorrect -> 0xc210), ack 1, win 229, options [nop,nop,TS val 1277744567 ecr 4160336178], length 0
15:13:40.039517 IP (tos 0x0, ttl 64, id 39095, offset 0, flags [DF], proto TCP (6), length 420)
    1.1.1.1.35466 > 2.2.2.2.2083: Flags [P.], cksum 0x1baf (incorrect -> 0xfc32), seq 1:369, ack 1, win 229, options [nop,nop,TS val 1277744568 ecr 4160336178], length 368
15:13:40.039663 IP (tos 0x0, ttl 64, id 43184, offset 0, flags [none], proto TCP (6), length 52)
    2.2.2.2.2083 > 1.1.1.1.35466: Flags [.], cksum 0x1a3f (incorrect -> 0xc098), ack 369, win 235, options [nop,nop,TS val 4160336179 ecr 1277744568], length 0
15:13:40.040962 IP (tos 0x0, ttl 64, id 43185, offset 0, flags [none], proto TCP (6), length 2718)
    2.2.2.2.2083 > 1.1.1.1.35466: Flags [P.], cksum 0x24a9 (incorrect -> 0xf754), seq 1:2667, ack 369, win 235, options [nop,nop,TS val 4160336180 ecr 1277744568], length 2666
15:13:40.041013 IP (tos 0x0, ttl 64, id 39096, offset 0, flags [DF], proto TCP (6), length 52)
    1.1.1.1.35466 > 2.2.2.2.2083: Flags [.], cksum 0x1a3f (incorrect -> 0xb609), ack 2667, win 270, options [nop,nop,TS val 1277744569 ecr 4160336180], length 0
15:13:40.042341 IP (tos 0x0, ttl 64, id 39097, offset 0, flags [DF], proto TCP (6), length 178)
    1.1.1.1.35466 > 2.2.2.2.2083: Flags [P.], cksum 0x1abd (incorrect -> 0xd2cd), seq 369:495, ack 2667, win 270, options [nop,nop,TS val 1277744571 ecr 4160336180], length 126
15:13:40.042745 IP (tos 0x0, ttl 64, id 43188, offset 0, flags [none], proto TCP (6), length 103)
    2.2.2.2.2083 > 1.1.1.1.35466: Flags [P.], cksum 0x1a72 (incorrect -> 0xff45), seq 2667:2718, ack 495, win 235, options [nop,nop,TS val 4160336182 ecr 1277744571], length 51
15:13:40.083284 IP (tos 0x0, ttl 64, id 39098, offset 0, flags [DF], proto TCP (6), length 52)
    1.1.1.1.35466 > 2.2.2.2.2083: Flags [.], cksum 0x1a3f (incorrect -> 0xb52b), ack 2718, win 270, options [nop,nop,TS val 1277744612 ecr 4160336182], length 0
```

RADIUS server has 30 seconds idle timeout and it closes the session after 30 seconds. It can also happen when the RADIUS server is restarted or connectivity is broken for some reason:
```
15:14:10.511047 IP (tos 0x0, ttl 64, id 43189, offset 0, flags [none], proto TCP (6), length 52)
    2.2.2.2.2083 > 1.1.1.1.35466: Flags [F.], cksum 0x3e49 (correct), seq 2718, ack 495, win 235, options [nop,nop,TS val 4160366650 ecr 1277744612], length 0
15:14:10.551332 IP (tos 0x0, ttl 64, id 39099, offset 0, flags [DF], proto TCP (6), length 52)
    1.1.1.1.35466 > 2.2.2.2.2083: Flags [.], cksum 0x1a3f (incorrect -> 0xc721), ack 2719, win 270, options [nop,nop,TS val 1277775080 ecr 4160366650], length 0
```
When a connection request comes to OCS server it tries to send RADIUS request to the closed session. It does not attempt to create a new TCP session.
```
15:15:24.148517 IP (tos 0x0, ttl 64, id 39100, offset 0, flags [DF], proto TCP (6), length 196)
    1.1.1.1.35466 > 2.2.2.2.2083: Flags [P.], cksum 0x1acf (incorrect -> 0x78b0), seq 495:639, ack 2719, win 270, options [nop,nop,TS val 1277848677 ecr 4160366650], length 144
15:15:24.148905 IP (tos 0x0, ttl 64, id 0, offset 0, flags [DF], proto TCP (6), length 40)
    2.2.2.2.2083 > 1.1.1.1.35466: Flags [R], cksum 0xebcc (correct), seq 380895386, win 0, length 0
```
OCS logs: 

```
Aug 18 15:15:21 myocserv.dom ocserv[2293]: ocserv[2293]: sec-mod: sec-mod instance 0 issue cookie
Aug 18 15:15:21 myocserv.dom ocserv[2293]: sec-mod: sec-mod instance 0 issue cookie
Aug 18 15:15:21 myocserv.dom ocserv[2293]: ocserv[2293]: sec-mod: using 'radius' authentication to authenticate user (session: ngMmW/)
Aug 18 15:15:21 myocserv.dom ocserv[2293]: sec-mod: using 'radius' authentication to authenticate user (session: ngMmW/)
Aug 18 15:15:24 myocserv.dom ocserv[2293]: ocserv[2293]: radius-auth: communicating username (myuser) and password
Aug 18 15:15:24 myocserv.dom ocserv[2293]: radius-auth: communicating username (myuser) and password
Aug 18 15:15:24 myocserv.dom ocserv[2293]: ocserv[2293]: radcli: tls_recvfrom: tls_recvfrom: error in receiving: The TLS connection was non-properly terminated.
Aug 18 15:15:24 myocserv.dom ocserv[2293]: ocserv[2293]: radcli: rc_send_server_ctx: rc_send_server: recvfrom: myradius.mydom:2083: Input/output error
Aug 18 15:15:24 myocserv.dom ocserv[2293]: radcli: tls_recvfrom: tls_recvfrom: error in receiving: The TLS connection was non-properly terminated.
Aug 18 15:15:24 myocserv.dom ocserv[2293]: radcli: rc_send_server_ctx: rc_send_server: recvfrom: myradius.mydom:2083: Input/output error
```
Afterwards it can be fixed only by restarting OCS.

We are using ocserv-1.1.3-1.el8.x86_64 and radcli-1.2.12-1.el8.x86_64. I haven't seen it could be fixed in 1.3 according to the release notes so I haven't checked  with 1.3 yet but I believe it's also affected.
